is_addition,old_file_path,new_file_path,line_num,content
False,src/main/java/org/apache/commons/math/optimization/direct/CMAESOptimizer.java,src/main/java/org/apache/commons/math/optimization/direct/CMAESOptimizer.java,43, CMA-ES algorithm. This code is translated and adapted from the Matlab version
False,src/main/java/org/apache/commons/math/optimization/direct/CMAESOptimizer.java,src/main/java/org/apache/commons/math/optimization/direct/CMAESOptimizer.java,44, of this algorithm as implemented in module {@code cmaes.m} version 3.51.
False,src/main/java/org/apache/commons/math/optimization/direct/CMAESOptimizer.java,src/main/java/org/apache/commons/math/optimization/direct/CMAESOptimizer.java,46, Implements the active Covariance Matrix Adaptation Evolution Strategy (CMA-ES)
True,src/main/java/org/apache/commons/math/optimization/direct/CMAESOptimizer.java,src/main/java/org/apache/commons/math/optimization/direct/CMAESOptimizer.java,43,* <p>An implementation of the active Covariance Matrix Adaptation Evolution Strategy (CMA-ES)
False,src/main/java/org/apache/commons/math/optimization/direct/CMAESOptimizer.java,src/main/java/org/apache/commons/math/optimization/direct/CMAESOptimizer.java,49," which should be applied, if derivative based methods, e.g. quasi-Newton BFGS or"
True,src/main/java/org/apache/commons/math/optimization/direct/CMAESOptimizer.java,src/main/java/org/apache/commons/math/optimization/direct/CMAESOptimizer.java,46,"* which should be applied if derivative-based methods, e.g. quasi-Newton BFGS or"
False,src/main/java/org/apache/commons/math/optimization/direct/CMAESOptimizer.java,src/main/java/org/apache/commons/math/optimization/direct/CMAESOptimizer.java,51," optima, outlier, etc.)  of the objective function. Like a"
False,src/main/java/org/apache/commons/math/optimization/direct/CMAESOptimizer.java,src/main/java/org/apache/commons/math/optimization/direct/CMAESOptimizer.java,52, quasi-Newton method the CMA-ES learns and applies a variable metric
False,src/main/java/org/apache/commons/math/optimization/direct/CMAESOptimizer.java,src/main/java/org/apache/commons/math/optimization/direct/CMAESOptimizer.java,53, of the underlying search space. Unlike a quasi-Newton method the
False,src/main/java/org/apache/commons/math/optimization/direct/CMAESOptimizer.java,src/main/java/org/apache/commons/math/optimization/direct/CMAESOptimizer.java,54," CMA-ES does neither estimate nor use gradients, making it considerably more"
False,src/main/java/org/apache/commons/math/optimization/direct/CMAESOptimizer.java,src/main/java/org/apache/commons/math/optimization/direct/CMAESOptimizer.java,55," reliable in terms of finding a good, or even close to optimal, solution, finally."
True,src/main/java/org/apache/commons/math/optimization/direct/CMAESOptimizer.java,src/main/java/org/apache/commons/math/optimization/direct/CMAESOptimizer.java,48,"* optima, outlier, etc.) of the objective function. Like a"
True,src/main/java/org/apache/commons/math/optimization/direct/CMAESOptimizer.java,src/main/java/org/apache/commons/math/optimization/direct/CMAESOptimizer.java,49,"* quasi-Newton method, the CMA-ES learns and applies a variable metric"
True,src/main/java/org/apache/commons/math/optimization/direct/CMAESOptimizer.java,src/main/java/org/apache/commons/math/optimization/direct/CMAESOptimizer.java,50,"* on the underlying search space. Unlike a quasi-Newton method, the"
True,src/main/java/org/apache/commons/math/optimization/direct/CMAESOptimizer.java,src/main/java/org/apache/commons/math/optimization/direct/CMAESOptimizer.java,51,"* CMA-ES neither estimates nor uses gradients, making it considerably more"
True,src/main/java/org/apache/commons/math/optimization/direct/CMAESOptimizer.java,src/main/java/org/apache/commons/math/optimization/direct/CMAESOptimizer.java,52,"* reliable in terms of finding a good, or even close to optimal, solution.</p>"
False,src/main/java/org/apache/commons/math/optimization/direct/CMAESOptimizer.java,src/main/java/org/apache/commons/math/optimization/direct/CMAESOptimizer.java,64, and/or badly conditioned problems.
False,src/main/java/org/apache/commons/math/optimization/direct/CMAESOptimizer.java,src/main/java/org/apache/commons/math/optimization/direct/CMAESOptimizer.java,65, To observe the advantage of CMA compared to a conventional
False,src/main/java/org/apache/commons/math/optimization/direct/CMAESOptimizer.java,src/main/java/org/apache/commons/math/optimization/direct/CMAESOptimizer.java,66," evolution strategy, it will usually take about <math>30 N</math> function"
False,src/main/java/org/apache/commons/math/optimization/direct/CMAESOptimizer.java,src/main/java/org/apache/commons/math/optimization/direct/CMAESOptimizer.java,67, evaluations. On difficult problems the complete
True,src/main/java/org/apache/commons/math/optimization/direct/CMAESOptimizer.java,src/main/java/org/apache/commons/math/optimization/direct/CMAESOptimizer.java,61,* and/or badly conditioned problems. To observe the advantage of CMA compared
True,src/main/java/org/apache/commons/math/optimization/direct/CMAESOptimizer.java,src/main/java/org/apache/commons/math/optimization/direct/CMAESOptimizer.java,62,"* to a conventional evolution strategy, it will usually take about"
True,src/main/java/org/apache/commons/math/optimization/direct/CMAESOptimizer.java,src/main/java/org/apache/commons/math/optimization/direct/CMAESOptimizer.java,63,* <math>30 N</math> function evaluations. On difficult problems the complete
True,src/main/java/org/apache/commons/math/optimization/direct/CMAESOptimizer.java,src/main/java/org/apache/commons/math/optimization/direct/CMAESOptimizer.java,68,* <p>This implementation is translated and adapted from the Matlab version
True,src/main/java/org/apache/commons/math/optimization/direct/CMAESOptimizer.java,src/main/java/org/apache/commons/math/optimization/direct/CMAESOptimizer.java,69,* of the CMA-ES algorithm as implemented in module {@code cmaes.m} version 3.51.</p>
False,src/main/java/org/apache/commons/math/optimization/direct/CMAESOptimizer.java,src/main/java/org/apache/commons/math/optimization/direct/CMAESOptimizer.java,105," Speed decreases, as a rule, at most linearely with increasing population"
True,src/main/java/org/apache/commons/math/optimization/direct/CMAESOptimizer.java,src/main/java/org/apache/commons/math/optimization/direct/CMAESOptimizer.java,104,"* Speed decreases, as a rule, at most linearly with increasing population"
False,src/main/java/org/apache/commons/math/optimization/direct/CMAESOptimizer.java,src/main/java/org/apache/commons/math/optimization/direct/CMAESOptimizer.java,1085," @return Diagonal n X n matrix if m is a column matrix, Rolumn matrix"
True,src/main/java/org/apache/commons/math/optimization/direct/CMAESOptimizer.java,src/main/java/org/apache/commons/math/optimization/direct/CMAESOptimizer.java,1084,"* @return Diagonal n X n matrix if m is a column matrix, Column matrix"
