is_addition,old_file_path,new_file_path,line_num,content
True,src/org/mockito/MockitoAnnotations.java,src/org/mockito/MockitoAnnotations.java,15,import org.mockito.runners.MockitoJUnit4Runner;
False,src/org/mockito/MockitoAnnotations.java,src/org/mockito/MockitoAnnotations.java,46, TODO we have now runners in mockito
False,src/org/mockito/MockitoAnnotations.java,src/org/mockito/MockitoAnnotations.java,50, You can also put it in your JUnit4 runner (&#064;RunWith).
False,src/org/mockito/MockitoAnnotations.java,src/org/mockito/MockitoAnnotations.java,52, <p>
False,src/org/mockito/MockitoAnnotations.java,src/org/mockito/MockitoAnnotations.java,53, How to implement mockito junit runner? See examples from mockito/test/org/mockitousage/examples/junitrunner subpackage.
False,src/org/mockito/MockitoAnnotations.java,src/org/mockito/MockitoAnnotations.java,54, You may want to check out the project from svn repository to easily browse Mockito's test code.
True,src/org/mockito/MockitoAnnotations.java,src/org/mockito/MockitoAnnotations.java,51,"* You can also use put it in your JUnit4 runner (&#064;RunWith) or use built-in runners: {@link MockitoJUnit4Runner}, {@link MockitoJUnit45Runner}"
