is_addition,old_file_path,new_file_path,line_num,content
False,src/java/org/apache/commons/codec/binary/Base64.java,src/java/org/apache/commons/codec/binary/Base64.java,303, Small optimization where we try to buffer directly to the consumer's
False,src/java/org/apache/commons/codec/binary/Base64.java,src/java/org/apache/commons/codec/binary/Base64.java,304, output array for one round (if consumer calls this method first!) instead
False,src/java/org/apache/commons/codec/binary/Base64.java,src/java/org/apache/commons/codec/binary/Base64.java,305, of starting our own buffer.
True,src/java/org/apache/commons/codec/binary/Base64.java,src/java/org/apache/commons/codec/binary/Base64.java,303,* Sets the streaming buffer. This is a small optimization where we try to buffer directly to the consumer's output
True,src/java/org/apache/commons/codec/binary/Base64.java,src/java/org/apache/commons/codec/binary/Base64.java,304,* array for one round (if the consumer calls this method first) instead of starting our own buffer.
